{
  "production_contract_version": "1.0.0",
  "vault_id": "zephyr-local-production-v1",
  "provider": "HIGGSFIELD_LOCAL_ARCHIVE",
  "ingestion_method": "VERIFIED_LOCAL_ASSET",
  "ingestion_surface": "READ_ONLY_LOCAL_FILESYSTEM",
  "ingestion_timestamp": "2026-08-11T21:27:37.912Z",
  "manifest_version": "1.0.0",
  "adapter_version": "1.0.0",
  "matcher_version": "0.2.0",
  "spec_version": "1.0.0",
  "asset_count": 54,
  "pagination_count": 1,
  "schema_valid_count": 54,
  "schema_invalid_count": 0,
  "duplicate_count": 0,
  "unknown_metadata_fields": [
    "artifacts",
    "audio",
    "canon_status",
    "characters",
    "continuity_identity_ids",
    "continuity_tags",
    "duration",
    "era",
    "factions",
    "location",
    "output_use",
    "project_id",
    "provider_asset_id",
    "rights_status",
    "soul_id",
    "studio_mode",
    "truth_state",
    "world"
  ],
  "rights_review_count": 54,
  "canon_review_count": 54,
  "continuity_review_count": 54,
  "canonical_identity_review_count": 54,
  "source_references": [
    "/mnt/c/Users/marqu/Dropbox/NEURO/Higgsfield/ZEPHYR_Characters_assets/ZEPHYR_Characters_assets/Alex (Battle Mode) [KIA].png",
    "/mnt/c/Users/marqu/Dropbox/NEURO/Higgsfield/ZEPHYR_Characters_assets/ZEPHYR_Characters_assets/Backrooms.png",
    "/mnt/c/Users/marqu/Dropbox/NEURO/Higgsfield/ZEPHYR_Characters_assets/ZEPHYR_Characters_assets/Chill room.png",
    "/mnt/c/Users/marqu/Dropbox/NEURO/Higgsfield/ZEPHYR_Characters_assets/ZEPHYR_Characters_assets/City 1.jpg",
    "/mnt/c/Users/marqu/Dropbox/NEURO/Higgsfield/ZEPHYR_Characters_assets/ZEPHYR_Characters_assets/City 2.jpg",
    "/mnt/c/Users/marqu/Dropbox/NEURO/Higgsfield/ZEPHYR_Characters_assets/ZEPHYR_Characters_assets/City 3.jpg",
    "/mnt/c/Users/marqu/Dropbox/NEURO/Higgsfield/ZEPHYR_Characters_assets/ZEPHYR_Characters_assets/City 4.jpg",
    "/mnt/c/Users/marqu/Dropbox/NEURO/Higgsfield/ZEPHYR_Characters_assets/ZEPHYR_Characters_assets/City 5.jpg",
    "/mnt/c/Users/marqu/Dropbox/NEURO/Higgsfield/ZEPHYR_Characters_assets/ZEPHYR_Characters_assets/Gym.png",
    "/mnt/c/Users/marqu/Dropbox/NEURO/Higgsfield/ZEPHYR_Characters_assets/ZEPHYR_Characters_assets/Haru Min (Episode 1 Base).png",
    "/mnt/c/Users/marqu/Dropbox/NEURO/Higgsfield/ZEPHYR_Characters_assets/ZEPHYR_Characters_assets/Haru Min in cockpit.png",
    "/mnt/c/Users/marqu/Dropbox/NEURO/Higgsfield/ZEPHYR_Characters_assets/ZEPHYR_Characters_assets/Haru Min's mech.jpg",
    "/mnt/c/Users/marqu/Dropbox/NEURO/Higgsfield/ZEPHYR_Characters_assets/ZEPHYR_Characters_assets/Haru Min's mecha.png",
    "/mnt/c/Users/marqu/Dropbox/NEURO/Higgsfield/ZEPHYR_Characters_assets/ZEPHYR_Characters_assets/Haru Min.jpg",
    "/mnt/c/Users/marqu/Dropbox/NEURO/Higgsfield/ZEPHYR_Characters_assets/ZEPHYR_Characters_assets/Haru min (Episode 1 Concert).jpg",
    "/mnt/c/Users/marqu/Dropbox/NEURO/Higgsfield/ZEPHYR_Characters_assets/ZEPHYR_Characters_assets/Kai (Battle Mode).jpg",
    "/mnt/c/Users/marqu/Dropbox/NEURO/Higgsfield/ZEPHYR_Characters_assets/ZEPHYR_Characters_assets/Kai.jpg",
    "/mnt/c/Users/marqu/Dropbox/NEURO/Higgsfield/ZEPHYR_Characters_assets/ZEPHYR_Characters_assets/Lightstick.jpg",
    "/mnt/c/Users/marqu/Dropbox/NEURO/Higgsfield/ZEPHYR_Characters_assets/ZEPHYR_Characters_assets/Magnetic transporter.jpg",
    "/mnt/c/Users/marqu/Dropbox/NEURO/Higgsfield/ZEPHYR_Characters_assets/ZEPHYR_Characters_assets/Main hangar.png",
    "/mnt/c/Users/marqu/Dropbox/NEURO/Higgsfield/ZEPHYR_Characters_assets/ZEPHYR_Characters_assets/Mira (Episode 1 Base) (After shower).png",
    "/mnt/c/Users/marqu/Dropbox/NEURO/Higgsfield/ZEPHYR_Characters_assets/ZEPHYR_Characters_assets/Mira (Episode 1 Base).png",
    "/mnt/c/Users/marqu/Dropbox/NEURO/Higgsfield/ZEPHYR_Characters_assets/ZEPHYR_Characters_assets/Mira (Episode 1 Concert).jpg",
    "/mnt/c/Users/marqu/Dropbox/NEURO/Higgsfield/ZEPHYR_Characters_assets/ZEPHYR_Characters_assets/Mira in cockpit.png",
    "/mnt/c/Users/marqu/Dropbox/NEURO/Higgsfield/ZEPHYR_Characters_assets/ZEPHYR_Characters_assets/Mira's mech.jpg",
    "/mnt/c/Users/marqu/Dropbox/NEURO/Higgsfield/ZEPHYR_Characters_assets/ZEPHYR_Characters_assets/Mira's mecha.png",
    "/mnt/c/Users/marqu/Dropbox/NEURO/Higgsfield/ZEPHYR_Characters_assets/ZEPHYR_Characters_assets/Mira.jpg",
    "/mnt/c/Users/marqu/Dropbox/NEURO/Higgsfield/ZEPHYR_Characters_assets/ZEPHYR_Characters_assets/Mob.jpg",
    "/mnt/c/Users/marqu/Dropbox/NEURO/Higgsfield/ZEPHYR_Characters_assets/ZEPHYR_Characters_assets/Naomi (Episode 1 Base).png",
    "/mnt/c/Users/marqu/Dropbox/NEURO/Higgsfield/ZEPHYR_Characters_assets/ZEPHYR_Characters_assets/Naomi (Episode 1 Concert).jpg",
    "/mnt/c/Users/marqu/Dropbox/NEURO/Higgsfield/ZEPHYR_Characters_assets/ZEPHYR_Characters_assets/Naomi in cockpit.png",
    "/mnt/c/Users/marqu/Dropbox/NEURO/Higgsfield/ZEPHYR_Characters_assets/ZEPHYR_Characters_assets/Naomi's mech.jpg",
    "/mnt/c/Users/marqu/Dropbox/NEURO/Higgsfield/ZEPHYR_Characters_assets/ZEPHYR_Characters_assets/Naomi's mecha.png",
    "/mnt/c/Users/marqu/Dropbox/NEURO/Higgsfield/ZEPHYR_Characters_assets/ZEPHYR_Characters_assets/Naomi's room.png",
    "/mnt/c/Users/marqu/Dropbox/NEURO/Higgsfield/ZEPHYR_Characters_assets/ZEPHYR_Characters_assets/Naomi.jpg",
    "/mnt/c/Users/marqu/Dropbox/NEURO/Higgsfield/ZEPHYR_Characters_assets/ZEPHYR_Characters_assets/Reina (Episode 1 Base) (Gym).png",
    "/mnt/c/Users/marqu/Dropbox/NEURO/Higgsfield/ZEPHYR_Characters_assets/ZEPHYR_Characters_assets/Reina (Episode 1 Base).png",
    "/mnt/c/Users/marqu/Dropbox/NEURO/Higgsfield/ZEPHYR_Characters_assets/ZEPHYR_Characters_assets/Reina (Episode 1 Concert).jpg",
    "/mnt/c/Users/marqu/Dropbox/NEURO/Higgsfield/ZEPHYR_Characters_assets/ZEPHYR_Characters_assets/Reina in cockpit.png",
    "/mnt/c/Users/marqu/Dropbox/NEURO/Higgsfield/ZEPHYR_Characters_assets/ZEPHYR_Characters_assets/Reina's mech.jpg",
    "/mnt/c/Users/marqu/Dropbox/NEURO/Higgsfield/ZEPHYR_Characters_assets/ZEPHYR_Characters_assets/Reina's mecha (back).png",
    "/mnt/c/Users/marqu/Dropbox/NEURO/Higgsfield/ZEPHYR_Characters_assets/ZEPHYR_Characters_assets/Reina's mecha.png",
    "/mnt/c/Users/marqu/Dropbox/NEURO/Higgsfield/ZEPHYR_Characters_assets/ZEPHYR_Characters_assets/Reina.jpg",
    "/mnt/c/Users/marqu/Dropbox/NEURO/Higgsfield/ZEPHYR_Characters_assets/ZEPHYR_Characters_assets/Shower room.png",
    "/mnt/c/Users/marqu/Dropbox/NEURO/Higgsfield/ZEPHYR_Characters_assets/ZEPHYR_Characters_assets/Tank (injured).png",
    "/mnt/c/Users/marqu/Dropbox/NEURO/Higgsfield/ZEPHYR_Characters_assets/ZEPHYR_Characters_assets/Tank.jpg",
    "/mnt/c/Users/marqu/Dropbox/NEURO/Higgsfield/ZEPHYR_Characters_assets/ZEPHYR_Characters_assets/Toshi.png",
    "/mnt/c/Users/marqu/Dropbox/NEURO/Higgsfield/ZEPHYR_Characters_assets/ZEPHYR_Characters_assets/Zero (Episode 1 Base).png",
    "/mnt/c/Users/marqu/Dropbox/NEURO/Higgsfield/ZEPHYR_Characters_assets/ZEPHYR_Characters_assets/Zero (Episode 1 Concert).jpg",
    "/mnt/c/Users/marqu/Dropbox/NEURO/Higgsfield/ZEPHYR_Characters_assets/ZEPHYR_Characters_assets/Zero in cockpit.png",
    "/mnt/c/Users/marqu/Dropbox/NEURO/Higgsfield/ZEPHYR_Characters_assets/ZEPHYR_Characters_assets/Zero's mech.jpg",
    "/mnt/c/Users/marqu/Dropbox/NEURO/Higgsfield/ZEPHYR_Characters_assets/ZEPHYR_Characters_assets/Zero's mecha.png",
    "/mnt/c/Users/marqu/Dropbox/NEURO/Higgsfield/ZEPHYR_Characters_assets/ZEPHYR_Characters_assets/Zero's room.png",
    "/mnt/c/Users/marqu/Dropbox/NEURO/Higgsfield/ZEPHYR_Characters_assets/ZEPHYR_Characters_assets/Zero.jpg"
  ],
  "manifest_fingerprint": "ad333aa6feaefe606ab3b65d0d3231ef2e16b59bf28ae8ed7d8cfdfc46bb79ec",
  "index_fingerprint": "b80c979bef9fa6554b14ec27fb8c9a38334c1c4a4b7d681dfea0ac48853e9d4d",
  "readiness_assessment": "LOCAL_INDEX_READY",
  "generation_fallback": "PROHIBITED",
  "local_archive_import": {
    "source_root": "/mnt/c/Users/marqu/Dropbox/NEURO/Higgsfield/ZEPHYR_Characters_assets/ZEPHYR_Characters_assets",
    "excluded_file_count": 1,
    "excluded_files": [
      ".DS_Store"
    ],
    "character_family_count": 9,
    "location_count": 12,
    "prop_count": 2,
    "mech_count": 11,
    "creature_count": 0,
    "duplicate_hash_count": 0,
    "requires_review_count": 54,
    "review_eligibility": "REVIEW_SEARCH_ONLY"
  }
}
